{"constraintContext":{"areaBasis":{"basisAreaM2":200,"declaredAreaM2":200,"differenceM2":0,"geometryAreaM2":200,"provenance":[{"condition":{"status":"user_provided","unit":"m2","value":200},"input":"site.area","reference":"sha256:3c693b57f138963754a5d42818ac5ebae61e8e0c1e821cb6aea85c566ab13223"},{"condition":{"status":"assumed","unit":"m2","value":200},"input":"geometry.areaM2","reference":"sha256:2b2555cbda288250663a375ee8f358ea21230a42ab112cb6989e29cbe20b7ccb"}],"selectedBasis":"declared_project_area"},"constraintCaps":{"maxFootprintAreaM2":160,"maxHeightM":31,"maxTotalFloorAreaM2":1200}},"inputReferences":{"constraints":"sha256:928c8548f007219d3b1cea13ce1b3fbceabaefc8d2220ca7cb2be4d11ae0bad0","geometry":"sha256:2b2555cbda288250663a375ee8f358ea21230a42ab112cb6989e29cbe20b7ccb","project":"sha256:3c693b57f138963754a5d42818ac5ebae61e8e0c1e821cb6aea85c566ab13223"},"rankedCandidates":[{"candidate":{"candidate":{"floorCount":7,"footprint":{"coordinates":[[[0.5419404195337654,0.9853462173341185],[9.486212329532925,0.9853462173341185],[11.275066711532755,9.929618127333278],[5.908503565533261,18.873890037332437],[0.5419404195337654,18.873890037332437],[0.5419404195337654,0.9853462173341185]]],"type":"Polygon"},"footprintAreaM2":160,"grossFloorAreaM2":1120,"heightM":28,"reviewRequired":true,"targetFootprintAreaM2":160},"constraintCaps":{"maxFootprintAreaM2":160,"maxHeightM":31,"maxTotalFloorAreaM2":1200},"generator":{"floorHeightM":4,"floorHeightStatus":"user_provided","footprintMethod":"convex_homothetic_footprint_v0.1","strategy":"max_footprint_stack_v0.1"},"inputReferences":{"constraints":"sha256:928c8548f007219d3b1cea13ce1b3fbceabaefc8d2220ca7cb2be4d11ae0bad0","geometry":"sha256:2b2555cbda288250663a375ee8f358ea21230a42ab112cb6989e29cbe20b7ccb","project":"sha256:3c693b57f138963754a5d42818ac5ebae61e8e0c1e821cb6aea85c566ab13223"},"schemaVersion":"0.1"},"candidateReference":"sha256:bb37010bbae5fe9f4b85fdb2b08f28c4a129c7df3fb1ee1d53756614b53d84aa","grossFloorAreaM2":1120,"rank":1},{"candidate":{"candidate":{"floorCount":6,"footprint":{"coordinates":[[[0.5419404195337654,0.9853462173341185],[9.486212329532925,0.9853462173341185],[11.275066711532755,9.929618127333278],[5.908503565533261,18.873890037332437],[0.5419404195337654,18.873890037332437],[0.5419404195337654,0.9853462173341185]]],"type":"Polygon"},"footprintAreaM2":160,"grossFloorAreaM2":960,"heightM":30,"reviewRequired":true,"targetFootprintAreaM2":160},"constraintCaps":{"maxFootprintAreaM2":160,"maxHeightM":31,"maxTotalFloorAreaM2":1200},"generator":{"floorHeightM":5,"floorHeightStatus":"user_provided","footprintMethod":"convex_homothetic_footprint_v0.1","strategy":"max_footprint_stack_v0.1"},"inputReferences":{"constraints":"sha256:928c8548f007219d3b1cea13ce1b3fbceabaefc8d2220ca7cb2be4d11ae0bad0","geometry":"sha256:2b2555cbda288250663a375ee8f358ea21230a42ab112cb6989e29cbe20b7ccb","project":"sha256:3c693b57f138963754a5d42818ac5ebae61e8e0c1e821cb6aea85c566ab13223"},"schemaVersion":"0.1"},"candidateReference":"sha256:a066398acfee9ab39f1800e8688e0200f4e70192a323480dc4a0ca4161b37434","grossFloorAreaM2":960,"rank":2},{"candidate":{"candidate":{"floorCount":5,"footprint":{"coordinates":[[[0.5419404195337654,0.9853462173341185],[9.486212329532925,0.9853462173341185],[11.275066711532755,9.929618127333278],[5.908503565533261,18.873890037332437],[0.5419404195337654,18.873890037332437],[0.5419404195337654,0.9853462173341185]]],"type":"Polygon"},"footprintAreaM2":160,"grossFloorAreaM2":800,"heightM":30,"reviewRequired":true,"targetFootprintAreaM2":160},"constraintCaps":{"maxFootprintAreaM2":160,"maxHeightM":31,"maxTotalFloorAreaM2":1200},"generator":{"floorHeightM":6,"floorHeightStatus":"user_provided","footprintMethod":"convex_homothetic_footprint_v0.1","strategy":"max_footprint_stack_v0.1"},"inputReferences":{"constraints":"sha256:928c8548f007219d3b1cea13ce1b3fbceabaefc8d2220ca7cb2be4d11ae0bad0","geometry":"sha256:2b2555cbda288250663a375ee8f358ea21230a42ab112cb6989e29cbe20b7ccb","project":"sha256:3c693b57f138963754a5d42818ac5ebae61e8e0c1e821cb6aea85c566ab13223"},"schemaVersion":"0.1"},"candidateReference":"sha256:b5d9d090d0d1ce75417656770c591d3e11f0a2a6720220551e44e2a076615928","grossFloorAreaM2":800,"rank":3},{"candidate":{"candidate":{"floorCount":4,"footprint":{"coordinates":[[[0.5419404195337654,0.9853462173341185],[9.486212329532925,0.9853462173341185],[11.275066711532755,9.929618127333278],[5.908503565533261,18.873890037332437],[0.5419404195337654,18.873890037332437],[0.5419404195337654,0.9853462173341185]]],"type":"Polygon"},"footprintAreaM2":160,"grossFloorAreaM2":640,"heightM":28,"reviewRequired":true,"targetFootprintAreaM2":160},"constraintCaps":{"maxFootprintAreaM2":160,"maxHeightM":31,"maxTotalFloorAreaM2":1200},"generator":{"floorHeightM":7,"floorHeightStatus":"user_provided","footprintMethod":"convex_homothetic_footprint_v0.1","strategy":"max_footprint_stack_v0.1"},"inputReferences":{"constraints":"sha256:928c8548f007219d3b1cea13ce1b3fbceabaefc8d2220ca7cb2be4d11ae0bad0","geometry":"sha256:2b2555cbda288250663a375ee8f358ea21230a42ab112cb6989e29cbe20b7ccb","project":"sha256:3c693b57f138963754a5d42818ac5ebae61e8e0c1e821cb6aea85c566ab13223"},"schemaVersion":"0.1"},"candidateReference":"sha256:89d81ef8a0eb4d4f5afebbd5c22b38980dad7de3be02207ca37673eb51a070c9","grossFloorAreaM2":640,"rank":4},{"candidate":{"candidate":{"floorCount":3,"footprint":{"coordinates":[[[0.5419404195337654,0.9853462173341185],[9.486212329532925,0.9853462173341185],[11.275066711532755,9.929618127333278],[5.908503565533261,18.873890037332437],[0.5419404195337654,18.873890037332437],[0.5419404195337654,0.9853462173341185]]],"type":"Polygon"},"footprintAreaM2":160,"grossFloorAreaM2":480,"heightM":24,"reviewRequired":true,"targetFootprintAreaM2":160},"constraintCaps":{"maxFootprintAreaM2":160,"maxHeightM":31,"maxTotalFloorAreaM2":1200},"generator":{"floorHeightM":8,"floorHeightStatus":"user_provided","footprintMethod":"convex_homothetic_footprint_v0.1","strategy":"max_footprint_stack_v0.1"},"inputReferences":{"constraints":"sha256:928c8548f007219d3b1cea13ce1b3fbceabaefc8d2220ca7cb2be4d11ae0bad0","geometry":"sha256:2b2555cbda288250663a375ee8f358ea21230a42ab112cb6989e29cbe20b7ccb","project":"sha256:3c693b57f138963754a5d42818ac5ebae61e8e0c1e821cb6aea85c566ab13223"},"schemaVersion":"0.1"},"candidateReference":"sha256:41d8652a38b8b4e3fc45ee04bb487753f1fd581e8e7231b39da9036100caa624","grossFloorAreaM2":480,"rank":5}],"rejections":[],"schemaVersion":"0.2","search":{"floorHeightStatus":"user_provided","floorHeightsM":[4,5,6,7,8],"ranking":"maximize_gross_floor_area_v0.1","strategy":"floor_height_sweep_v0.1"},"summary":{"accepted":5,"evaluated":5,"hasFeasibleCandidate":true,"rejected":0,"reviewRequired":true}}
